<?xml version="1.0" encoding="UTF-8"?>
<a:Zahtevi xmlns:vc="http://www.w3.org/2007/XMLSchema-versioning"
    xmlns:a="http://www.zavod.com/Autorska"
    xmlns:xsi="http://www.w3.org/2001/XMLSchema-instance"
    xsi:schemaLocation="http://www.zavod.com/Autorska file:/home/pavle/Documents/XML/Projekat/xml-ws-2022/backends/autorska/src/main/resources/xml/a1.xsd">
    <a:Zahtev>
        <a:Podnosilac xsi:type="a:TPravno_Lice">
            <a:ime>Firma DOO</a:ime>
            <a:sediste>Dr Ivana Ribara 13</a:sediste>
        </a:Podnosilac>
        <a:Delo>
            <a:naslov>naslov0</a:naslov>
            <a:alternativni_naslov>alternativni_naslov0</a:alternativni_naslov>
            <a:vrsta_dela>vrsta_dela0</a:vrsta_dela>
            <a:forma_zapisa>forma_zapisa0</a:forma_zapisa>
            <a:radni_odnos>false</a:radni_odnos>
            <a:nacin_koriscenja>nacin_koriscenja0</a:nacin_koriscenja>
        </a:Delo>
        <a:Informacije_Zavoda>
            <a:opis_dela>opis_dela0</a:opis_dela>
            <a:primer_dela>
            </a:primer_dela>
            <a:broj_prijave>A-0</a:broj_prijave>
            <a:datum_podsnosenja>2006-05-04</a:datum_podsnosenja>
        </a:Informacije_Zavoda>
    </a:Zahtev>
    <a:Zahtev>
        <a:Podnosilac xsi:type="a:TFizicko_Lice">
            <a:ime>Petar</a:ime>
            <a:telefon>+38123456789</a:telefon>
            <a:email>pera@gmail.com</a:email>
            <a:prezime>Peric</a:prezime>
            <a:adresa>Maksima Gorkog 10</a:adresa>
            <a:drzavljanstvo>srpsko</a:drzavljanstvo>
        </a:Podnosilac>
        <a:Delo>
            <a:naslov>Izabrana dela</a:naslov>
            <a:alternativni_naslov>Perina izabrana dela</a:alternativni_naslov>
            <a:vrsta_dela>zbirka</a:vrsta_dela>
            <a:forma_zapisa>rukopis</a:forma_zapisa>
            <a:radni_odnos>false</a:radni_odnos>
            <a:nacin_koriscenja>nacin koriscenja</a:nacin_koriscenja>
        </a:Delo>
        <a:Informacije_Zavoda>
            <a:opis_dela>opis_dela1</a:opis_dela>
            <a:primer_dela>primer_dela1</a:primer_dela>
            <a:broj_prijave>A-1</a:broj_prijave>
            <a:datum_podsnosenja>2006-05-04</a:datum_podsnosenja>
        </a:Informacije_Zavoda>
    </a:Zahtev>
</a:Zahtevi>
