<?xml version="1.0" encoding="UTF-8"?>
<a:Zahtevi xmlns:vc="http://www.w3.org/2007/XMLSchema-versioning"
 xmlns:a="http://www.zavod.com/Autorska"
 xmlns:xsi="http://www.w3.org/2001/XMLSchema-instance"
 xsi:schemaLocation="http://www.zavod.com/Autorska file:/home/pavle/Documents/XML/Projekat/xml-ws-2022/backends/autorska/src/main/resources/xml/a1.xsd">
    <a:Zahtev>
        <a:Podnosilac xsi:type="a:TPravno_Lice">
            <a:ime>Firma DOO</a:ime>
            <a:sediste>Dr Ivana Ribara 13</a:sediste>
        </a:Podnosilac>
        <a:Delo>
            <a:naslov>naslov0</a:naslov>
            <a:alternativni_naslov>alternativni_naslov0</a:alternativni_naslov>
            <a:vrsta_dela>vrsta_dela0</a:vrsta_dela>
            <a:forma_zapisa>forma_zapisa0</a:forma_zapisa>
            <a:radni_odnos>false</a:radni_odnos>
            <a:nacin_koriscenja>nacin_koriscenja0</a:nacin_koriscenja>
        </a:Delo>
        <a:Informacije_Zavoda>
            <a:broj_prijave>A-0000-00</a:broj_prijave>
            <a:datum_podsnosenja>2006-05-04</a:datum_podsnosenja>
            <a:prilozi>
                <a:primer_dela>
                    <a:putanja>putanja0</a:putanja>
                    <a:naziv_datoteke>naziv_datoteke0</a:naziv_datoteke>
                </a:primer_dela>
                <a:opis_dela>
                    <a:putanja>putanja1</a:putanja>
                    <a:naziv_datoteke>naziv_datoteke1</a:naziv_datoteke>
                </a:opis_dela>
                <a:punomocje>
                    <a:putanja>putanja2</a:putanja>
                    <a:naziv_datoteke>naziv_datoteke2</a:naziv_datoteke>
                </a:punomocje>
                <a:uplata>
                    <a:putanja>putanja3</a:putanja>
                    <a:naziv_datoteke>naziv_datoteke3</a:naziv_datoteke>
                </a:uplata>
            </a:prilozi>
        </a:Informacije_Zavoda>
        <a:Informacije_Sistema>
            <a:username>username0</a:username>
            <a:email>email0</a:email>
        </a:Informacije_Sistema>
    </a:Zahtev>
    <a:Zahtev>
        <a:Podnosilac xsi:type="a:TFizicko_Lice">
            <a:ime>Petar</a:ime>
            <a:telefon>+38123456789</a:telefon>
            <a:email>pera@gmail.com</a:email>
            <a:prezime>Peric</a:prezime>
            <a:adresa>Maksima Gorkog 10</a:adresa>
            <a:drzavljanstvo>srpsko</a:drzavljanstvo>
        </a:Podnosilac>
        <a:Delo>
            <a:naslov>Izabrana dela</a:naslov>
            <a:alternativni_naslov>Perina izabrana dela</a:alternativni_naslov>
            <a:vrsta_dela>zbirka</a:vrsta_dela>
            <a:forma_zapisa>rukopis</a:forma_zapisa>
            <a:radni_odnos>false</a:radni_odnos>
            <a:nacin_koriscenja>nacin koriscenja</a:nacin_koriscenja>
        </a:Delo>
        <a:Informacije_Zavoda>
            <a:broj_prijave>A-0000-00</a:broj_prijave>
            <a:datum_podsnosenja>2006-05-04</a:datum_podsnosenja>
            <a:prilozi>
                <a:primer_dela>
                    <a:putanja>putanja4</a:putanja>
                    <a:naziv_datoteke>naziv_datoteke4</a:naziv_datoteke>
                </a:primer_dela>
                <a:opis_dela>
                    <a:putanja>putanja5</a:putanja>
                    <a:naziv_datoteke>naziv_datoteke5</a:naziv_datoteke>
                </a:opis_dela>
                <a:punomocje>
                    <a:putanja>putanja6</a:putanja>
                    <a:naziv_datoteke>naziv_datoteke6</a:naziv_datoteke>
                </a:punomocje>
                <a:uplata>
                    <a:putanja>putanja7</a:putanja>
                    <a:naziv_datoteke>naziv_datoteke7</a:naziv_datoteke>
                </a:uplata>
            </a:prilozi>
        </a:Informacije_Zavoda>
        <a:Informacije_Sistema>
            <a:username>username1</a:username>
            <a:email>email1</a:email>
        </a:Informacije_Sistema>
    </a:Zahtev>
</a:Zahtevi>
